Combination_Name,Pillar_1_Tech_Leverage,Pillar_2_Domain_or_Language,Pillar_3_Execution_Skill,The_Unfair_Advantage,Growth_Score_Out_Of_10
"The Global AI Architect","AI / Machine Learning","Foreign Language (Japanese/German)","Cross-Cultural Communication","Bypasses saturated local IT markets to access aging economies with massive tech shortages.",10.0
"The Bio-Data Sovereign","Cloud Computing & Data Pipelines","Genomics / Molecular Biology","Regulatory Compliance (FDA/HIPAA)","Standard software engineers can't read genomes; biologists can't build scalable cloud systems. You do both.",9.5
"The Cyber-Physical Defender","Cybersecurity & Ethical Hacking","Legacy Infrastructure (Power/Water Grids)","High-Stress Crisis Management","Protects physical city infrastructure from digital attacks. IT grads don't understand civil grids; civil engineers don't understand hacking.",9.5
"The Climate-Quant","Big Data Predictive Modeling","Environmental / Climate Science","Carbon Accounting & Finance Law","Translates physical climate risks into actionable financial data for global hedge funds and insurance companies.",9.0
"The Med-Tech UX Alchemist","Spatial Computing (AR/VR/XR)","Human Anatomy & Neurobiology","Behavioral Psychology & UX","Designs VR surgical simulators. Pure tech designers lack the required clinical and anatomical accuracy.",9.0
"The Quantum-Fintech Elite","Quantum Algorithm Development","High-Frequency Trading Finance","Extreme Algorithmic Consistency","Operates at the theoretical limits of physics to give financial institutions microsecond market advantages.",10.0
"The Autonomous Supply Lead","Robotic Process Automation (RPA)","Global Supply Chain Logistics","Negotiation & Mandarin Fluency","Automates global shipping routes while seamlessly communicating and negotiating directly with eastern manufacturing hubs.",8.5